[
  {
    "accepted_answer_id": 1,
    "answer_count": 1,
    "answers": [
    ],
    "body": "some string",
    "body_markdown": "some string",
    "bounty_amount": 1,
    "bounty_closes_date": 1,
    "bounty_user": {
      "accept_rate": 1,
      "badge_counts": {
        "bronze": 1,
        "gold": 1,
        "silver": 1
      },
      "display_name": "some string",
      "link": "some string",
      "profile_image": "some string",
      "reputation": 1,
      "user_id": 1,
      "user_type": "some string"
    },
    "can_close": true,
    "can_flag": true,
    "close_vote_count": 1,
    "closed_date": 1,
    "closed_details": {
      "by_users": [
      ],
      "description": "some string",
      "on_hold": true,
      "original_questions": [
      ],
      "reason": "some string"
    },
    "closed_reason": "some string",
    "comment_count": 1,
    "comments": [
    ],
    "community_owned_date": 1,
    "creation_date": 1,
    "delete_vote_count": 1,
    "down_vote_count": 1,
    "downvoted": true,
    "favorite_count": 1,
    "favorited": true,
    "is_answered": true,
    "last_activity_date": 1,
    "last_edit_date": 1,
    "last_editor": {
      "accept_rate": 1,
      "badge_counts": {
        "bronze": 1,
        "gold": 1,
        "silver": 1
      },
      "display_name": "some string",
      "link": "some string",
      "profile_image": "some string",
      "reputation": 1,
      "user_id": 1,
      "user_type": "some string"
    },
    "link": "some string",
    "locked_date": 1,
    "migrated_from": {
      "on_date": 1,
      "other_site": {
        "aliases": [
        ],
        "api_site_parameter": "some string",
        "audience": "some string",
        "closed_beta_date": 1,
        "favicon_url": "some string",
        "high_resolution_icon_url": "some string",
        "icon_url": "some string",
        "launch_date": 1,
        "logo_url": "some string",
        "markdown_extensions": [
        ],
        "name": "some string",
        "open_beta_date": 1,
        "related_sites": [
        ],
        "site_state": "some string",
        "site_type": "some string",
        "site_url": "some string",
        "styling": {
          "link_color": "some string",
          "tag_background_color": "some string",
          "tag_foreground_color": "some string"
        },
        "twitter_account": "some string"
      },
      "question_id": 1
    },
    "migrated_to": {
      "on_date": 1,
      "other_site": {
        "aliases": [
        ],
        "api_site_parameter": "some string",
        "audience": "some string",
        "closed_beta_date": 1,
        "favicon_url": "some string",
        "high_resolution_icon_url": "some string",
        "icon_url": "some string",
        "launch_date": 1,
        "logo_url": "some string",
        "markdown_extensions": [
        ],
        "name": "some string",
        "open_beta_date": 1,
        "related_sites": [
        ],
        "site_state": "some string",
        "site_type": "some string",
        "site_url": "some string",
        "styling": {
          "link_color": "some string",
          "tag_background_color": "some string",
          "tag_foreground_color": "some string"
        },
        "twitter_account": "some string"
      },
      "question_id": 1
    },
    "notice": {
      "body": "some string",
      "creation_date": 1,
      "owner_user_id": 1
    },
    "owner": {
      "accept_rate": 1,
      "badge_counts": {
        "bronze": 1,
        "gold": 1,
        "silver": 1
      },
      "display_name": "some string",
      "link": "some string",
      "profile_image": "some string",
      "reputation": 1,
      "user_id": 1,
      "user_type": "some string"
    },
    "protected_date": 1,
    "question_id": 1,
    "reopen_vote_count": 1,
    "score": 1,
    "share_link": "some string",
    "tags": [
    ],
    "title": "some string",
    "up_vote_count": 1,
    "upvoted": true,
    "view_count": 1
  }
]